{
  "order_id": "6f1c2a4e-8a43-4b7e-9a51-2a3f0c9d1e77",
  "client_order_id": "cli-0001",
  "account": "ACC-1",
  "symbol": "AAPL",
  "side": "BUY",
  "qty": 100,
  "price": 189.25,
  "ts": "2026-10-27T09:30:00.123Z",
  "status": "ACCEPTED",
  "notional": 18925.0,
  "processed_at": "2026-10-27T09:30:00.250Z"
}
